title,description,duration,passing_score,is_published,question_text,question_type,answer_mode,points,option_1,option_2,option_3,option_4,correct_option,correct_options
Basic Math Quiz,Simple math questions for students,2,70,true,What is 2 + 2?,multiple_choice,radio,1,3,4,5,6,2,
Basic Math Quiz,Simple math questions for students,2,70,true,Select all even numbers,multiple_choice,checkbox,1,2,3,4,5,,1|3
Basic Math Quiz,Simple math questions for students,2,70,true,10 is greater than 5,true_false,radio,1,True,False,,,1,
Science Quiz,General science questions,5,75,true,Which planet is known as the Red Planet?,multiple_choice,radio,1,Earth,Mars,Jupiter,Venus,2,
Science Quiz,General science questions,5,75,true,Select the states of matter,multiple_choice,checkbox,1,Solid,Liquid,Blue,Gas,,1|2|4
